{
  "schema_version": 1,
  "id": "tiny_test",
  "seed": 20260,
  "radius_m": 6000,
  "face_resolution": 128,
  "relief": {
    "min_m": -500,
    "max_m": 700
  },
  "symmetry": {
    "rotational": 8,
    "wedge_start_deg": 22.5
  },
  "base_noise": {
    "octaves": 2,
    "freq_per_circumference": 4,
    "amp_m": 0,
    "lacunarity": 2.0,
    "gain": 0.5,
    "warp_m": 0
  },
  "slots": {
    "count": 2,
    "lon0_deg": 22.5,
    "spacing_deg": 45,
    "flatten_radius_m": 2000,
    "flatten_edge_m": 500,
    "flatten_slope_deg": 5,
    "facing_deg": 0
  },
  "poles": {
    "noon_plateau_radius_m": 600,
    "noon_plateau_height_m": 0,
    "midnight_ice_ring": true
  },
  "biome_rules": "default",
  "resources": {
    "slot_features": [],
    "ring_features": [],
    "pole_features": [],
    "unused_slot_yield": 0.5
  },
  "notes": "ART-37 fixture: fails M11 only (docs/07 s9.5); consumed by tools/tests/test_moonbake.py"
}
