{
  "schema_version": 1, "id": "cradle", "seed": 91027, "radius_m": 6000.0,
  "face_resolution": 1024, "relief": {"min_m": -500, "max_m": 700},
  "symmetry": {"rotational": 8, "wedge_start_deg": 22.5},
  "base_noise": {"octaves": 5, "freq_per_circumference": 6, "amp_m": 90, "lacunarity": 2.0, "gain": 0.5, "warp_m": 300},
  "highlands": {"amplitude_m": 350, "mask_frequency": 1.2, "threshold": 0.55, "softness": 0.15},
  "regions": [{"kind": "mare", "lat": 8, "lon": 45, "radius_m": 3200, "floor_m": -320, "edge_m": 600}],
  "craters": {"explicit": [{"lat": 30, "lon": 45, "diam_m": 2400, "depth_m": 280, "rim_m": 220, "ejecta_m": 3600},
                           {"lat": -35, "lon": 40, "diam_m": 500, "depth_m": 120, "rim_m": 60, "ejecta_m": 900}],
              "scatter": {"per_wedge": 60, "diam_m": [60, 600], "power": 2.2, "seed_offset": 7}},
  "rilles": [{"path": [[10, 32], [22, 45], [28, 57]], "width_m": 160, "depth_m": 70}],
  "slots": {"count": 8, "lon0_deg": 22.5, "spacing_deg": 45, "flatten_radius_m": 300, "flatten_edge_m": 150, "flatten_slope_deg": 5, "facing_deg": 0},
  "poles": {"noon_plateau_radius_m": 1000, "noon_plateau_height_m": 150, "midnight_ice_ring": true},
  "boulder_fields": [{"lat": -5, "lon": 34, "radius_m": 800, "density": 0.4}],
  "biome_rules": "default",
  "resources": {
    "slot_features": [{"id": "field_a", "kind": "ore_field", "bearing_deg": 30, "distance_m": 900, "capacity": 6000, "regen_per_s": 2.0, "radius_m": 250, "max_miners": 3}],
    "ring_features": [{"id": "relay", "kind": "relay_station", "lat_deg": 0, "lon_offset_deg": 22.5},
                      {"id": "mid_trap", "kind": "cold_trap", "lat_deg": -35, "lon_offset_deg": 17.5, "capacity": 8000, "rate_per_s": 1.5, "radius_m": 60}],
    "pole_features": [{"id": "midnight_a", "kind": "cold_trap", "pole": "midnight", "bearing_deg": 0, "distance_m": 600, "capacity": 6000, "rate_per_s": 0.9, "radius_m": 60}],
    "unused_slot_yield": 0.5
  }
}
